title,abstract,description,prerequisites
The Best of Both Worlds: A Hybrid Approach to Lightning-Fast Product Matching,"In an era dominated by data, businesses struggle with processing diverse, unstructured information across systems. This research presents an AI-powered pipeline addressing product matching challenges in retail and e-commerce. Our solution combines traditional matching algorithms with deep learning through a five-step process. This approach minimizes manual intervention while improving accuracy and efficiency.","In today's data-driven world, businesses face the challenge of managing vast amounts of information, often from diverse and unstructured sources. This complexity necessitates efficient and accurate data processing techniques to extract meaningful insights and drive informed decision-making. One such critical task is product matching, where the goal is to accurately identify and link records representing the same product across different systems or datasets. This is particularly crucial for businesses operating in industries with complex product catalogs, such as retail, manufacturing, and e-commerce. Our project solves this problem by developing a robust, AI-powered pipeline to automate the matching process while minimizing human intervention.
The task involved matching incoming product records with a standardized catalog, referred to as the ""G_List,"" which includes essential attributes. The primary challenge lay in the inherent variability and inconsistency of product data. Incoming records often included: spelling and grammatical errors, data inconsistencies, multilingual variations. Examples of the challenge include identifying that ""Yellow Glass whiskey 1L,"" ""Color Whiskey 1L glas,"" and ""GLAS amarillo whiskey"" all correspond to ""GLASS YELLOW WHISKEY 1L"" in the G_List.
Our solution comprises five key steps. First, we created the G_List by standardizing product data and attributes. Next, we consolidated source data into a unified data lake, where records were cleaned and transformed. The third step utilized the tfidf_matcher Python library for initial matching. Step four, feature extraction. Finally, a  deep learning model assessed the matches as either ""PASS"" or ""NOT PASS."" Records flagged as ""PASS"" were automatically labeled and finalized, while ""NOT PASS"" records were escalated for manual review.
This hybrid approach of combining matching algorithms with AI significantly reduced manual workload while improving accuracy.",Basic Computer Science knowledge.
Building Compliant and Robust AI Systems: Navigating the EU AI Act with Python,"This session provides a concise overview of EU AI Act compliance tailored for Python developers building AI systems. We'll explore key compliance areas, including risk management, robust model testing, cybersecurity, and explainability, highlighting practical tools and popular Python libraries.","In this talk, you'll gain essential insights into aligning Python-based AI system development with the EU AI Act’s regulatory requirements. We'll begin with a brief introduction to the EU AI Act’s core concepts, risk tiers, and certification expectations, emphasizing what matters most for practical compliance.",Interest in AI system development
,,,
Putting PyTorch Models into Production,"Deploying PyTorch models into production requires balancing performance, hardware efficiency, and cost optimization. Developers face challenges such as GPU memory constraints during training, suboptimal inference latency, and escalating cloud infrastructure expenses. For instance, modern models like LLMs demand specialized strategies to reduce GPU memory footprint while maintaining throughput.","Deploying PyTorch models into production requires balancing performance, hardware efficiency, and cost optimization. Developers face challenges such as GPU memory constraints during training, suboptimal inference latency, and escalating cloud infrastructure expenses. For instance, modern models like LLMs demand specialized strategies to reduce GPU memory footprint while maintaining throughput. Meanwhile, serving architectures often suffer from poor hardware utilization due to rigid microservice designs, leading to unnecessary costs. This session addresses these pain points by providing a roadmap for transitioning PyTorch models from research to production, emphasizing GPU optimization and cost-aware serving.",PyTorch basics
Knowledge Bases & Memory for Agentic AI,"Some of the latest big evolutionary steps in generative AI has been models that support function calling and “agentic” capabilities.  This is provides generative models with “tools” that allow them to go beyond generating outputs for simple queries, and start planning the best way to solve complex queries.  In this talk, we’ll be diving into using vector databases as the backbone for these types of complex AI architectures, both serving as knowledge bases, and memory.","In this technical talk, we will start by covering the history of how agentic AI came about. We will go over how we can design prompts in a way that instruct LLMs to use tools and plan out how to solve complex queries. Next, we will learn about function calling and how this feature of LLMs can be used as the basis of agents.",Basic understanding of vector databases and vector search would be useful.
"Artificial Intelligence in Open-Source Project Management: Automating Tasks, Predicting Outcomes, and Optimizing Resources","As artificial intelligence continues to evolve, there is a growing need for project maintainers to leverage on AI to foster diverse and inclusive collaborations. In this session, I will discuss importance of artificial intelligence in open-source project management, actionable strategies to maximize diverse talents and promote transparency, tools and technologies available for project maintainers, and practical ways to leverage these technologies to make a meaningful impact within open-source communities.","In this session, there will be interactive sessions and case studies to provide practical insights and how to navigate various forms of challenges and opportunities to aid my objectives which include;",No specific skills
"Anonymization of sensitive information in financial documents using, python, diffusion models and named entity recognition","Unlock sensitive data potential with anonymization! Learn how Python, diffusion models, and Named Entity Recognition (NER) empower institutions to anonymize PII in financial documents, replacing it with synthetic stand-ins. Discover open-source, self-hosted tools to ensure privacy while unleashing data's full power.","Anonymization of sensitive information in financial documents using, python, diffusion models and named entity recognition",Python
Enhancing Model Context Protocol (MCP) with Dynamic Tool Discovery for Smarter AI,"The Model Context Protocol (MCP) is an emerging standard that enables structured data provisioning for LLMs and AI agents. However, the current data discovery mechanism in MCP is static.  This limits the AI’s ability to dynamically assess the utility, relevance, and efficiency of data tool calls in real time.  Here I present an enhancement to MCP ""tool discovery"" that introduces dynamic data descriptions, allowing LLM to be better informed.",This talk will introduce the concept of MCP with a demonstration of how MCP clients and servers. How they are built and how they interact.,"Python, LLM"
Code Generation in Regulated Industries: Opportunities and Challenges,"AI-driven code generation can transform software development in regulated sectors like banking and insurance - but only if implemented securely and responsibly. In this talk, we’ll explore how to harness tools like GitHub Copilot and ChatGPT to boost productivity while ensuring compliance. Attendees will learn key considerations, best practices, and practical insights to keep code generation both efficient and fully auditable.","In highly regulated industries, code quality, security, and compliance are paramount. Yet recent advances in AI-driven coding assistants promise faster development, fewer errors, and improved agility. How do we tap into these benefits without introducing unacceptable risk?",None
EGTL data-processing model prototype using Python,"Discover how EGTL (Extract, Generate, Transfer, Load) extends traditional ETL by adding a “generate” step powered by GenAI. In this talk, I’ll demonstrate how Python pipelines on top of data warehouse can automatically extract data, generate new insights, and deliver optimized transformations. We’ll explore practical workflows, real-world use cases, and best practices—equipping you to apply EGTL in your own data projects.","Experience a novel approach to data ingestion pipelines with EGTL (Extract, Generate, Transfer, Load), a practical evolution of the standard ETL process. By incorporating a “generate” step powered by GenAI into the workflow, EGTL unlocks new potential in data transformation, advanced data analytics, and automation. In this talk, I’ll walk you through the core components of EGTL, demonstrating how Python-based data pipelines can leverage generative AI to produce enriched datasets on the fly before transferring and loading them into downstream systems.
Using real-world use cases, I’ll illustrate how EGTL benefits both data engineers and scientists by reducing manual overhead, accelerating iterative development, and unveiling unexpected insights. You’ll learn implementation best practices—covering everything from tool selection and architecture design to error handling and governance. This talk will highlight key strategies for integrating GenAI directly into your pipelines.","data engineering, automation, big data application develpment"
AI 360: From Theory to Transformation,"This talk charts the evolution of Artificial Intelligence through the dual lenses of data and models, tracing AI’s journey from early symbolic systems to today’s advanced data-driven techniques. Attendees will learn how the interplay of ever-growing datasets and increasingly sophisticated model architectures has powered major breakthroughs, transforming AI from theoretical curiosity to a global catalyst for innovation.","We will begin by examining AI’s early days, when handcrafted rules and symbolic reasoning took center stage despite limited data and computational resources. Next, the spotlight shifts to the rise of machine learning and neural networks, as larger datasets and improved computing power enabled more flexible, adaptive models. Along the way, we will highlight pivotal milestones—such as the resurgence of deep learning—that propelled AI forward at an accelerated pace. By focusing on how evolving data availability and model complexity shaped each phase of AI, this session provides a comprehensive historical perspective and offers insights into how AI’s trajectory continues to unfold in today’s data-rich world.",General curiosity in AI
"GenAI for Clients: No pain, no gain",What is the way from prove of concept to big production solutions for GenAI application? How to make it scalable and make one release by 7 sprints?,"We talk about different GenAI Accenture cases in production and preproduction studies, how to implement new technologies and what advantages and disadvantages we can discover during such projects. How often client really know what they want? GenAI ""magic"" tricks or 99% accuracy? Let's talk about LLM, stable diffusion and similarity search.","AI fundamentals, Programming, Azure fundamentals, AWS fundamentals"
