title,abstract,description,prerequisites
Using feature stores to deliver awesome models,"In today’s fast-paced machine learning environment, the ability to efficiently manage and reuse features across multiple models is crucial. This workshop explores how leveraging a feature store can streamline ML pipelines by ensuring consistency and accelerating deployment cycles.
Participants will gain hands-on experience with setting up, managing, and integrating feature stores into their existing workflows—transforming raw data into valuable, production-ready features.","Join us for an immersive, hands-on session designed for data scientists, ML engineers, and AI enthusiasts eager to optimize their machine learning pipelines through advanced feature store functionality. In this workshop, we will focus on the robust capabilities of an open-source feature store platform Feast that streamlines the entire feature lifecycle without requiring you to reinvent the wheel.","Experience in model training, basic SQL knowledge, basic K8s knowledge"
Orchestrating an end-to-end Data Engineering Workflow:  Leveraging Python in Apache Beam and Airflow,"This talk explores the synergy between Apache Beam and Apache Airflow, demonstrating how to create a robust, end-to-end data engineering workflow. We'll dive into the challenges of orchestrating complex data processing tasks and show how combining Airflow's scheduling capabilities with Beam's data processing framework can create more efficient and manageable data pipelines. The session will cover integration with Google Cloud Platform services, including Cloud Functions, BigQuery, and Gemini AI models.","Problem Addressed:
In today's data-driven world, organizations face the daunting challenge of orchestrating complex, end-to-end data engineering workflows that seamlessly integrate batch and streaming processing, scheduling, cloud services, and AI models. This talk tackles the often-overlooked synergy between Apache Beam and Apache Airflow, two powerful tools in the data engineering ecosystem that are rarely used in tandem. We'll explore how combining these technologies with Google Cloud Platform services and cutting-edge AI models can revolutionize data pipeline architecture.",Basic Python and SQL Knowledge
Data Warehouses Meet Data Lakes,"Many organizations have migrated their data warehouses to datalake solutions in recent years.
With the convergence of the data warehouse and the data lake, a new data management paradigm has emerged that combines the best of 2 approaches: the botton-up of big data and the top-down of a classic data warehouse.","In this talk, I will explain the current challenges of a datalake and how we can approach a
moderm data architecture with the help of pyspark, hudi, delta.io or iceberg.
We will see how organize data in a data lake to support real-time processing of applications
and analyzes across all varieties of data sets, structured and unstructured, how provides
the scale needed to support enterprise-wide digital transformation and creates one unique source of data
for multiple audiences.",Nothing
cluster-experiments: A Python library for end-to-end A/B testing workflows,"In this talk, we introduce cluster-experiments, a Python library designed to facilitate end-to-end A/B testing workflows, including power analysis, experiment analysis, and variance reduction techniques.","We will go through the main techniques for mde analysis (simulation based and using Central limit theorem), how to do variance reduction in mde analysis and how to analyse experiments with the same library.","python, basic stats knowledge"
Cutting the price of Scraping Cloud Costs,"A case study of rewriting a simple data pipeline involving Python, a pinch of Go, Git workflows, Airflow, Postgres and Cloud. Investigating some common assumptions and principles of designing data pipelines.
The benefits and issues with the tools and how these may be handled.
I hope this case study of a pipeline rewrite will give you insights that are applicable to Python use for your own data pipelines, and into cloud pricing.","Get answers to the following options and more, as to what is the cheapest and most maintainable solution for this kind of data pipeline.","Python, some exposure to cloud. Some basics of databases and data pipeline may be useful."
"Smarter Retrieval, Better Generation: Improving RAG Systems","Good retrieval performance is key to an effective RAG system, as it ensures relevant information is selected, directly impacting augmentation and generation quality. My presentation focuses on RAG indexing and retrieval, exploring methods to convert text into searchable formats, comparing techniques, and analyzing their advantages, disadvantages, and performance on an annotated dataset to enhance document retrieval based on user queries.","Retrieval Augmented Generation (RAG) is a model architecture for tasks requiring information retrieval from large corpora combined with generative models to fulfill a user information need. It's typically used for question-answering, fact-checking, summarization, and information discovery.",Simply knowing that any information system needs to first index and then retrieve documents should be enough.
Temporal: Bulletproof Workflows,"Temporal is an open source, distributed, and scalable workflow orchestration platform designed to execute mission-critical business logic with resilience. Manage failures, network outages, flaky endpoints, long-running processes and more, ensuring your workflows never fail.","Are you ready for the next generation of orchestration platforms? Temporal is the successor to Uber Cadence. It is an open source, distributed, and scalable workflow orchestration platform to execute mission-critical business logic with resilience. Your code will run reliably even if it encounters problems, such as network outages or server crashes. With great Developer Experience (DX) and Python SDK, the platform simplifies coding. Join us to unlock the power of Python and Temporal in mastering workflow orchestration!",There are no prerequisites for attending this talk; everyone is welcome regardless of prior knowledge.
Image deduplication using embeddings,"This presentation examines approaches for detecting and eliminating near-duplicate images across datasets ranging from small collections to repositories containing millions of images. We will compare the performance of several embedding models, including CLIP, ResNet, and other variants, assessing their ability to capture semantic and perceptual similarity and performance tradeoffs. We will benchmark various vector database solutions on query speed, memory consumption, and scalability. We will demonstrate p",,General ML and database understanding might be helpfull
Data-Driven Impact in Africa,"There are a lot of NGOs in Africa, trying to help improve lives. The problem is we do not have enough data to help them understand us well to curate impactful humanitarian programs.","Explore how data science can revolutionize NGO work in Africa, focusing on ethical data handling, machine learning applications, and community impact.","python basics, understanding data structures and analysis"
"AI Agents and Digital Trust, The Utilisation of Python In Enhancing Safety In The African Health Care  System","AI agents and digital trust are revolutionizing African healthcare via Python-powered innovations. Advanced machine learning models, built with robust Python libraries, enhance diagnostic precision, predictive analytics, and medical imaging analysis while bolstering cybersecurity and enabling telemedicine. Strict adherence to data privacy, transparency, and ethical standards is crucial to building trust, overcoming infrastructure challenges, and driving sustainable improvements in patient safety and care.","Artificial Intelligence (AI) agents and digital trust are pivotal in transforming healthcare delivery across Africa, where challenges such as limited infrastructure, scarce resources, and high patient loads demand innovative solutions. Python, renowned for its simplicity and extensive libraries, has become a cornerstone in developing AI-driven applications that enhance diagnostic accuracy, enable predictive analytics, and improve medical imaging analysis. These advanced systems also fortify cybersecurity measures, ensuring that sensitive patient data remains secure. Telemedicine platforms and AI chatbots extend medical services to remote and underserved communities, bridging gaps in access to quality care. Moreover, AI-driven decision support systems streamline clinical workflows and reduce human error, empowering healthcare professionals to make informed treatment decisions. Building digital trust is essential; strict adherence to data privacy, transparency, and ethical standards underpins every technological advancement. Collaborative efforts among governments, academic institutions, and private stakeholders are crucial for investing in AI education and infrastructure development. This comprehensive approach not only addresses immediate healthcare challenges but also lays the foundation for a resilient, future-ready system that can serve as a global model for responsible AI deployment in medicine. By continuously embracing innovation and maintaining rigorous standards, Africa’s healthcare ecosystem can achieve sustainable improvements in patient safety, service quality, and equitable access to care. Furthermore, the integration of AI in healthcare is not merely a technological upgrade but a transformative process that redefines patient engagement and clinical decision-making. The use of Python accelerates the development cycle, enabling rapid prototyping and deployment of scalable solutions tailored to the unique challenges of African health systems. Leveraging real-time data analytics a","The knowledge that will be brought to this talk will be about the African health ecosystem,  the infrastructural deficit,  the humongous opportunities abundant in the continent and how to navigate the terrain using data, this talk will be embedded in pure research."
Real-Time Data Analytics at Scale: From Ingestion to Retrieval,"Real-time data analytics is essential for powering modern applications like monitoring, personalization, search, and to some extend, RAG pipelines. However, building systems that can handle real-time ingestion, indexing, and retrieval at scale is no trivial task. This talk provides actionable insights into designing and maintaining such systems at scale using best practices.","Real-time data analytics systems are the backbone of modern applications, from monitoring and personalization to powering search experiences. However, building scalable systems that handle real-time ingestion, indexing, and retrieval efficiently can be daunting. This talk will explore the key components of such systems, including ingestion pipelines (Apache Kafka, Apache Pulsar etc), indexing layers (Elasticsearch, OpenSearch, FAISS, etc), and computation engines (Apache Flink, Apache Spark, custom Python-based solutions...). With the arrival of LLMs and Retrieval Augmented Generation (RAG), data indexation and retrieval become more critical than ever. We will address complex scenarios such asdisaster recovery, data reconciliation, and ensuring low-latency performance at scale. Attendees will leave with actionable insights and best practices to design, implement, and maintain robust real-time analytics systems tailored to their needs.",basic of data engneering/analytics
FastAPI and LamaIndex: A Powerful Combination for AI-Powered Web Development,Take your web apps to the next level by combining FastAPI's speed and efficiency with LamaIndex's AI-driven search engine. This talk will show you how to create powerful search-as-a-service APIs. Unlock new possibilities for your users with advanced search capabilities.,"Ready to supercharge your search capabilities? In today's data-driven world, delivering relevant search results quickly is crucial for a great user experience. But how can you harness the power of AI to make it happen? That's where FastAPI and LamaIndex come in - a dynamic duo that makes it easy to build AI-powered search engines.",Python basics
When safety is non-negotiable - 3 stages of building safety using data & AI,"The more users your platform attracts, the more unwanted attention you'll get from people looking to game your system. While every product is unique, the journey of tackling these bad actors tends to follow similar patterns across companies. In this talk, I'll walk you through the three stages of platform protection that I've witnessed firsthand, and how to level up your safety game using the data you have.","Building effective platform safety isn't a sprint—it's an evolution. Drawing from real-world experience, this session breaks down the three critical phases of safety maturity: from reactive monitoring (""crawl""), to proactive protection (""walk""), to sophisticated, AI-powered prevention (""run""). We'll examine what separates each stage and the exact capabilities needed to advance your safety operations. You'll discover practical approaches to transform your existing data into powerful AI-driven safety tools that shield users from harm while preserving their experience.","None, the topic is more introductory on how to utilise data & AI in safety"
AI Coding Agents and how to code them,"AI Agents are the next big thing everyone has been talking about. They are expected to revolutionize various industries by automating routine tasks, mission critical business workflows, enhancing productivity, and enabling humans to focus on creative and strategic work. Of course, you can apply them to your everyday coding tasks as well.","In this talk we’ll go over what those agents can bring to the table of coding world, and why they can deliver the promise of coding smarter that the current generation of coding assistants can’t. We will then dive right into a quick live coding session where I’ll show what such agents can do in real life and how you can start using them to enhance your everyday life already right after the talk. And we’ll finish off with some remarks on what the future of programming might look like in the near future as those agents get included into your everyday life.",Knowledge about LLM and GenAI
Leveraging Large Language Models for Automated Generation and Validation of Financial Descriptions for Lithuanian Companies,"Scoris.lt utilized Large Language Models (LLMs) to address the challenge of improving SEO performance by generating financial descriptions for Lithuanian companies. The case study highlights the innovative application of LLMs and custom translation models to create high-quality, multilingual content at scale.","The session would outline the implementation of a scalable AI solution by Scoris.lt. Facing challenges with Google search rankings due to a lack of text-based content, Scoris employed LLMs to generate financial descriptions in Lithuanian. The solution combined open-source models for cost efficiency and high throughput, supported by fine-tuned translation models for linguistic accuracy.",None
Retrieval-Augmented Generation for Culturally Nuanced Emotion Analysis in Nigerian Afrobeats Lyrics,"This talk presents a retrieval-augmented generation system tailored for emotion analysis in Nigerian Afrobeats lyrics. Integrating supplementary dictionaries with a hierarchical classifier can enable the system retrieve culturally relevant context to refine emotion predictions. We discuss the architecture, implementation challenges and potential for addressing code-mixing and linguistic nuances in low-resource settings.","In this talk, we introduce a novel retrieval-augmented generation (RAG) system designed to enhance emotion analysis in Nigerian Afrobeats lyrics. Our approach combines supplementary linguistic resources including Igbo-English, Yoruba-English, Pidgin-English, and English-Hausa dictionaries, with a hierarchical classifier. The system first uses a root-level classifier to assign a meta-emotion and then retrieves contextually relevant passages from a combined corpus of lyrics and dictionary entries. This retrieved context is appended to the original input, allowing the branch-level classifier to make more informed fine-grained predictions.","AI, LLMS, Music"
Unlocking the Power of Python and PyTorch for Biomedical Image Segmentation,"How can machine learning enhance biomedical image analysis? This talk explores the potential of Python and PyTorch in automating artifact and damage segmentation. From data preprocessing to clustering-based label classification and deep learning-driven segmentation, key techniques will be discussed, including the use of Convolutional Neural Network architectures. The session will also cover performance evaluation and insights into advancing biomedical imaging with AI-driven solutions.","The field of pathology is undergoing rapid digitalization, integrating new technologies that optimize workflows, reduce manual effort, and enhance diagnostic accuracy. However, preprocessing remains a labor-intensive step, requiring specialists to manually segment out artifacts before further analysis can take place. This talk explores how Python and PyTorch can be leveraged to automate this crucial preprocessing stage using machine learning techniques.",Machine Learning basics (preferably Biomedical field)
"📂 Slow Productivity AI: Automating Knowledge & Task Management with Offline Hugging Face, n8n & Obsidian","Modern work demands constant context-switching—emails, notes, meetings, and tasks pile up, leaving us overwhelmed. This talk introduces a<b>slow productivity AI</b>approach, inspired by<b>Cal Newport</b>, that leverages<b>offline, open-source automation</b>using<b>Hugging Face, n8n, and Obsidian</b>. By structuring knowledge into meaningful tasks<b>without disrupting deep work</b>, we can create a<b>sustainable, low-distraction workflow</b>—working smarter, not just faster.","In his book Slow Productivity, Cal Newport argues that modern work culture prioritizes busyness over effectiveness, leading to stress, shallow work, and burnout. But what if AI could enhance deep work rather than create more digital noise?",Basic Python knowledge
Vectors Everywhere: An Introduction to Vector Databases,"You have probably heard of vector databases while learning about embeddings used in deep learning models or while exploring Retrieval Augmented Generation(RAG).
In that case, you might be wondering why not just use SQL databases or NoSQL databases.
In this talk you will learn what embeddings are, and what vector databases are, why they are useful and when to use them. Expect to understand why vector databases are preferred for certain applications over SQL and NoSQL databases.","Vector databases have become more commonplace with the adoption of LLMs in various systems. You may have heard of vector databases in passing and are wondering what they are and why they are all the rage despite SQL databases having stood the test of time. You might remember learning about vectors in school and are wondering what's their relation to LLMs.
In this talk, we will learn about vectors, embeddings and vector databases. You will form an understanding of when vector databases are applicable and work through how to use open source vector databases.
This session is perfect for Python developers, data engineers and ML engineers curious about data storage and retrieval. Join us to learn the basics of vector databases and how they are powering some of the world's AI systems.",Python and SQL databases.
Build Your Own Observability Tool from Scratch for AI Agents,"In this hands-on workshop, we will learn how to develop a custom observability solution tailored for AI agents. From logs and metrics to guardrail checks and cost tracking, we’ll discover how to monitor crucial elements like accuracy, latency, and environmental impact. Walk away with your own tool and best practices to ensure AI agents are both well-observed and well-behaved.","AI agents can exhibit complex behaviors, including inconsistent accuracy, and unexpected spikes in resource usage. Traditional monitoring tools often fail to capture these nuances effectively. In this workshop, we will build an observability tool from scratch using Python, integrating techniques like advanced logging, metrics tracking, guardrail checks, and real-time dashboards. We will also address carbon emissions and cost visibility, highlighting the importance of responsible AI development. By the end, you’ll have a solid understanding of how to create a fully customizable solution that scales and adapts to your AI workflows.","Basics of AI Agents, Python and related tools"
The Emergence of Agentic Workflows in AI,"AI is evolving from passive tools to autonomous agents, driving the rise of agentic workflows that can plan, execute, and optimize tasks with minimal human input. This session will explore how large language models and multi-agent collaboration power these systems, enhancing efficiency and innovation. Attendees will gain insights into real-world applications, challenges, and the future of autonomous AI systems, uncovering how agentic workflows are transforming industries.","As AI systems transition from passive tools to autonomous agents, agentic workflows are emerging as a new paradigm. These AI-driven systems autonomously plan, execute, and optimize tasks with minimal human input, transforming areas like automation and decision-making. This session will focus on how developers can leverage large language models and multi-agent collaboration to build efficient, innovative agentic workflows. Code examples using a popular agentic framework will be demonstrated, providing hands-on insights into real-world applications. Attendees will also explore challenges and future directions for autonomous AI systems, gaining valuable knowledge on how agentic workflows are accelerating AI-driven change.",Familiarity with LLMs
I messed up so you don't: Surprisal and the headache of tokenizer encodings in LLMs!,"What can go wrong with tokenizer encodings? Everything! I will share my experience of understanding, misunderstanding, and ultimately learning to work with tokenization in LLMs. I will discuss what surprisal is, its relevance to my research, and its connection to tokenization. The talk will include various examples illustrating how misunderstandings of tokenization can arise, as well as strategies for debugging and preventing these issues.",,"Basic Python, and interest in NLP/LLMs"
A Crash course in Time Series Forecasting from Naive to Foundational,Forecasting is a common activity that has clear business value in various domains but it is not a very common skill that Data Scientists have or feel confident about. In this crash course I will cover the fundamentals of Time Series forecasting from the basic methods to more advanced techniques. I will do this showcasing practical code examples using libraries from Nixtla.,This is a technical talk that aims to provide the essential elements for a Data Scientist to go from zero knowledge of time series forecasting to being able to code a forecasting system that can evolve from a basic setup that can be put in production.,Basic Python skills. A background in Data Science is beneficial
“Beginner's Guide to building Autonomous AI Agents with Eliza Framework”,"AI agents are becoming fundamental building blocks of modern applications, thanks to their capability of understanding context with the help of the LLMs, but with added capability to interact with systems, files. AI agents that can meaningfully interact across platforms while maintaining context aren't just for large tech companies anymore as we have a number of open source AI Agent frameworks now which developers can leverage. This beginner-friendly, hands-on tutorial shows the process of creating autonomo","We'll break down the complexities of AI agent development into understandable components. Starting with basic concepts and progressing to functional implementations, participants will learn how to create, deploy, and manage AI agents that can handle real-world tasks with the help of the Eliza AI Agent framework. Finally we will have a hands on demo","basics of python, vector search, llm"
"How We Outperformed Microsoft, Google, and OpenAI in Speech-to-Text","We built a cutting-edge speech-to-text model that outperformed solutions from industry leaders like Microsoft, Google, and OpenAI. This is the story of how we identified a market gap, defined what makes ""the best model,"" and turned our vision into a successful business.","In this talk, I’ll share my personal journey of how we started our own business and built an innovative audio (speech-to-text) model that outperformed the offerings of industry giants like Microsoft, Google, and OpenAI. I’ll discuss how we identified a crucial gap in the market, carried out in-depth analysis to define what makes ""the best model,"" and overcame the challenges of competing with established players. This story is about determination, creativity, and the power of a focused vision, showing that even small teams can achieve big results when they find the right opportunities.",curiosity
